Публикация №,Заголовок,Ссылка на публикацию,Изображение,Описание,Цена,Город,Расположение,Дата добавления
1,Luxury Two Bedroom Apartment in Bloor West - Swansea,https://www.kijiji.ca/v-apartments-condos/city-of-toronto/luxury-two-bedroom-apartment-in-bloor-west-swansea/1630407999,https://media.kijiji.ca/api/v1/ca-prod-fsbo-ads/images/77/775698cd-f508-4159-b4cf-f630a0c7d3c8?rule=kijijica-200-jpg,"[ONLY TWO UNITS REMAINING!] Gorgeous, renovated luxury apartment in prime Swansea location! Stunning kitchen features extra-depth quartz counters, stainless appliances (including dishwasher and ...","$2,695.00",City of Toronto,South Kingsway,< 20 hours ago
2,O’Connor/St.Clair (one bedroom),https://www.kijiji.ca/v-apartments-condos/city-of-toronto/o-connor-st-clair-one-bedroom/1647792153,https://media.kijiji.ca/api/v1/ca-prod-dealer-ads/images/18/18e090f0-418c-4bfb-b78b-af21ba819d83?rule=kijijica-200-jpg,"One bedroom apartment in a lower rise apartment building, spacious, clean, bright, newly renovated, close to transportation and shopping. Asking for $1500.00/ month which includes heat water and ...","$1,500.00",City of Toronto,Sunnybrook Road,20/01/2023
3,1 Bedroom Coach House for Rent in Midtown Toronto!,https://www.kijiji.ca/v-apartments-condos/city-of-toronto/1-bedroom-coach-house-for-rent-in-midtown-toronto/1641537122,https://media.kijiji.ca/api/v1/ca-prod-dealer-ads/images/15/158acbfe-bed9-4154-8ef9-b3d9704a92ca?rule=kijijica-200-jpg,"Touch free leasing: Virtual viewings via video conferencing and online leasing available. Book yours today. Our Rental Office remains operational in light of COVID-19. The health and safety of you, ...","$2,625.00",City of Toronto,O'Connor Drive,20/01/2023
4,"1 Bdrm à louer au 1216 York Mills Road, Toronto",https://www.kijiji.ca/v-apartments-condos/city-of-toronto/1-bdrm-a-louer-au-1216-york-mills-road-toronto/1647477039,https://media.kijiji.ca/api/v1/ca-prod-dealer-ads/images/17/175aabda-611a-4c6b-afcf-5d552b8c04a2?rule=kijijica-200-jpg,"Visit our Website: https://www.capreit.ca/fr/appartements-a-louer/toronto-on/don-view-towers/ Rental Office is located at 2265 Victoria Park, Scarborough This friendly 8-storey, 65-suite building ...","$2,245.00",Toronto,Gardens Crescent,< 2 hours ago
5,Buy Condo with Zero Down near Lawrence / Kingston -RENT TO OWN,https://www.kijiji.ca/v-apartments-condos/city-of-toronto/buy-condo-with-zero-down-near-lawrence-kingston-rent-to-own/1625489341,https://media.kijiji.ca/api/v1/ca-prod-dealer-ads/images/16/167f9cc9-9c85-4c5a-aca5-b019d71763b7?rule=kijijica-200-jpg,Program # 1 -- Buy House with Our Zero Down Program Program # 2 -- Buy House with Rent To Own Program * Special Program for Self-Employed* * Special Program for New Immigrants* * Any Credit or No ...,Please Contact,City of Toronto,Sandover Drive,12/01/2023
6,Long Branch - Etobicoke - 2 Bedroom Apt for Rent by the Lake,https://www.kijiji.ca/v-apartments-condos/city-of-toronto/long-branch-etobicoke-2-bedroom-apt-for-rent-by-the-lake/1647624535,https://media.kijiji.ca/api/v1/ca-prod-fsbo-ads/images/67/67a81906-0ebd-4d44-b829-288269c18205?rule=kijijica-200-jpg,"Brand new everything!! Completely updated 2-bedroom, lower level in a well maintained triplex. Kitchen has caesar stone countertops and island with custom pendant light, new appliances, built-in ...","$2,350.00",City of Toronto,Clayland Drive,18/01/2023
7,A basement at North York,https://www.kijiji.ca/v-apartments-condos/city-of-toronto/a-basement-at-north-york/1647623408,,"A basement with a private washroom for rent Leslie/Finch, - A spacious room in the basement, located in the heart of North York, step to public transit, minutes walk to shopping , grocery, ...",$950.00,City of Toronto,Lawrence Avenue East,18/01/2023
8,Furnished 1 Bedroom Apartment Yonge & Finch,https://www.kijiji.ca/v-apartments-condos/city-of-toronto/furnished-1-bedroom-apartment-yonge-finch/1647621767,https://media.kijiji.ca/api/v1/ca-prod-fsbo-ads/images/91/918c4b63-24b4-44d2-a3bf-af345244d4b2?rule=kijijica-200-jpg,"A true 1 bedroom, ready to move-in on Yonge Subway Line. Tastefully furnished with quality settings and full-size kitchen. Compact Washer/dryer. Sign lease for 6 months+ up to one year. Clean, ...","$2,600.00",City of Toronto,Galloway Road,18/01/2023
9,3 bedroom semi detached house on rent( Finch & Birchmount),https://www.kijiji.ca/v-apartments-condos/city-of-toronto/3-bedroom-semi-detached-house-on-rent-finch-birchmount/1647621708,https://media.kijiji.ca/api/v1/ca-prod-fsbo-ads/images/3b/3b65a968-6383-4126-b989-e857b74a830e?rule=kijijica-200-jpg,"3 bedroom upper level of a Semi-detached House for Rent The house is located at the intersection of Finch and Birchmount. 3 minutes walking to bus station on Birchmount, 5 minutes walking to bus ...","$2,600.00",City of Toronto,Lake Shore Boulevard West,18/01/2023
10,Stunning 2 BEDROOM + 2 BATHROOM CONDO/Renovated/Downtown,https://www.kijiji.ca/v-apartments-condos/city-of-toronto/stunning-2-bedroom-2-bathroom-condo-renovated-downtown/1647621224,https://media.kijiji.ca/api/v1/ca-prod-fsbo-ads/images/ae/aefc7905-040f-48cc-86cc-2bacdfbc483f?rule=kijijica-200-jpg,"TORONTO PRIME QUEEN WEST LOCATION !! ""Trendiest Neighbourhood"" Luxurious Modern Newly Renovated 2 Bedroom + 2 Full Bathrooms With Soaker Tubs Condo. - Spacious 600+ Sqft. Living Space / Split Bedroom ...","$2,795.00",City of Toronto,41st Street,18/01/2023
11,Mount Pleasant & St. Clair - Lower Suite For Lease,https://www.kijiji.ca/v-apartments-condos/city-of-toronto/mount-pleasant-st-clair-lower-suite-for-lease/1647619507,https://media.kijiji.ca/api/v1/ca-prod-dealer-ads/images/31/31ec7fd2-0034-4d3b-910a-d51a92371dee?rule=kijijica-200-jpg,"Sapcious (~1500 Sqf) Only 5 Steps Lower than Ground Level Private Entrance Lots Of Storage In Upscale Area En-Suite Laundry 2 Min Walk To Ttc, 15 Min Walk To Yonge & St Clair Subway, 2 Min Walk Water ...","$2,450.00",City of Toronto,McNicoll Avenue,18/01/2023
12,"Prime Harbourfront location at 10 Yonge St., 19th Floor.",https://www.kijiji.ca/v-apartments-condos/city-of-toronto/prime-harbourfront-location-at-10-yonge-st-19th-floor/1643695622,https://media.kijiji.ca/api/v1/ca-prod-fsbo-ads/images/53/5354d6b8-38b5-4eef-a511-b4d6ff5cac33?rule=kijijica-200-jpg,"Prime Harbourfront location at 10 Yonge St., 19th Floor - Luxurious Waterfront Living (Across from Pier (former Captain John's Diner Boat Dock) and the Harbour Castle Westin Hotel). Luxurious Large ...","$2,599.00",City of Toronto,Zircon Court,18/01/2023
13,Stunning two bed unit by Donmills,https://www.kijiji.ca/v-apartments-condos/city-of-toronto/stunning-two-bed-unit-by-donmills/1647616761,https://media.kijiji.ca/api/v1/ca-prod-fsbo-ads/images/75/75b72052-fa4e-4a35-a59f-0ea47aef33ba?rule=kijijica-200-jpg,Stunning two bed two bath units available March1. The unit is less than one year and have spacious space with full windows and living room. Have amazing spa and amenities ready for tenants and ...,"$2,850.00",City of Toronto,Kenneth Avenue,18/01/2023
14,ROOMS FOR RENT,https://www.kijiji.ca/v-apartments-condos/city-of-toronto/rooms-for-rent/1647614738,https://media.kijiji.ca/api/v1/ca-prod-fsbo-ads/images/7d/7d137075-ec02-47b9-961f-0ab42e52f312?rule=kijijica-200-jpg,Only girls can apply Large & Bright Corner Unit With Unobstructed Panoramic South West View. 3 Bedrooms & 2 Full Baths W/Great Functional Layout. Good Size Master Bedroom W/Ensuite. Stainless Steel ...,Please Contact,City of Toronto,Empress Avenue,18/01/2023
15,Spacious furnished 1 bedroom condo for rent,https://www.kijiji.ca/v-apartments-condos/city-of-toronto/spacious-furnished-1-bedroom-condo-for-rent/1647611958,https://media.kijiji.ca/api/v1/ca-prod-fsbo-ads/images/48/48872892-194e-4b8f-8895-1055da4c2372?rule=kijijica-200-jpg,"Spacious 1-bedroom condo for rent near the edge of liberty village just a short walk from groceries, restaurants, bars, and trinity bellwoods. Apartment is available for Rent on Feb 1st (or sooner if ...","$2,400.00",City of Toronto,Birchmount Road,18/01/2023
16,103 West Lodge - 1 Bed 1 Bath in the Heart of Parkdale Apartment,https://www.kijiji.ca/v-apartments-condos/city-of-toronto/103-west-lodge-1-bed-1-bath-in-the-heart-of-parkdale-apartment/1644768248,https://media.kijiji.ca/api/v1/ca-prod-dealer-ads/images/30/30f5db4c-9454-45a3-9802-6f2b3bf76128?rule=kijijica-200-jpg,"1 Bed 1 Bath in the Heart of Parkdale West Lodge provides a way of life in its inclusive, diverse and welcoming community. You will love living close to schools, libraries, parks (including our own ...","$1,889.00",City of Toronto,Timberbank Boulevard,18/01/2023
17,2 Bedroom Apt.- North York-,https://www.kijiji.ca/v-apartments-condos/city-of-toronto/2-bedroom-apt-north-york/1633933603,https://media.kijiji.ca/api/v1/ca-prod-dealer-ads/images/50/505e5df0-345c-4d23-a198-efd7319783ff?rule=kijijica-200-jpg,"2A Style-WAITING LIST IN EFFECT - PLEASE EMAIL TO BE THE FIRST TO KNOW WHEN WE WILL HAVE AVAILABILITY This Spacious 2 bedroom apartment features 3 appliances (fridge, stove and dishwasher), large ...","$1,999.00",City of Toronto,Dovercourt Road,18/01/2023
18,2 Bedroom Apartment for Rent Steps to Victoria Park Station!,https://www.kijiji.ca/v-apartments-condos/city-of-toronto/2-bedroom-apartment-for-rent-steps-to-victoria-park-station/1618391411,https://media.kijiji.ca/api/v1/ca-prod-dealer-ads/images/df/df8166bf-463a-46c6-ac45-ece4d93fcba6?rule=kijijica-200-jpg,"Touch free leasing: Virtual viewings via video conferencing and online leasing available. Book yours today. Our Rental Office remains operational in light of COVID-19. The health and safety of you, ...","$3,000.00",City of Toronto,Sudbury Street,18/01/2023
19,"2 Bdrm available at 2020 Sheppard Ave West, Toronto",https://www.kijiji.ca/v-apartments-condos/city-of-toronto/2-bdrm-available-at-2020-sheppard-ave-west-toronto/1637589811,https://media.kijiji.ca/api/v1/ca-prod-dealer-ads/images/62/62d8b566-1338-4879-ba13-1c210f5386d9?rule=kijijica-200-jpg,Visit our Website: https://www.capreit.ca/apartments-for-rent/toronto-on/lafayette-apartments/ Lafayette Apartments is located in the North York area within a great residential neighborhood at Jane & ...,"$2,570.00",City of Toronto,Mount Pleasant Road,18/01/2023
20,"1 Bdrm available at 18 Panorama Court, Etobicoke",https://www.kijiji.ca/v-apartments-condos/city-of-toronto/1-bdrm-available-at-18-panorama-court-etobicoke/1644717879,https://media.kijiji.ca/api/v1/ca-prod-dealer-ads/images/f1/f1730062-8992-409d-b183-a620b800a290?rule=kijijica-200-jpg,"Visit our Website: https://www.capreit.ca/apartments-for-rent/etobicoke-on/panorama-apartments/ Panorama Apartments is a level above the rest. Our residents enjoy beautiful, large one, two and three ...","$2,250.00",Etobicoke,Glenrose Avenue,18/01/2023
21,3 Bedroom Townhome Available In Prestigious Midtown Davisville,https://www.kijiji.ca/v-apartments-condos/city-of-toronto/3-bedroom-townhome-available-in-prestigious-midtown-davisville/1637589081,https://media.kijiji.ca/api/v1/ca-prod-dealer-ads/images/ce/ceae6499-b8e8-47a0-bbde-524e6f308cf5?rule=kijijica-200-jpg,"Exceptional 3 bedrooms, 2.5-bathroom executive townhome available for rent conveniently located at Yonge and Balliol Street, close to the scenic Beltline walking trial, walking distance to both ...","$4,100.00",City of Toronto,Leslie Street,18/01/2023
22,1 bedroom basement apartment in Royal York-Mimico area  $1650,https://www.kijiji.ca/v-apartments-condos/city-of-toronto/1-bedroom-basement-apartment-in-royal-york-mimico-area-1650/1647608156,https://media.kijiji.ca/api/v1/ca-prod-fsbo-ads/images/29/294ef6a8-ea45-45d8-873e-bf46dcdf7358?rule=kijijica-200-jpg,"All inclusive. Clean, bright and spacious 1 bdr basement apartment in the Royal York-Mimico area. Separate entrance, private laundry. Close to all amenities, within walking distance to the lake, TTC ...","$1,650.00",City of Toronto,Greenhill Avenue,18/01/2023
23,1 Bedroom on Top Floor for Rent!,https://www.kijiji.ca/v-apartments-condos/city-of-toronto/1-bedroom-on-top-floor-for-rent/1647609699,https://media.kijiji.ca/api/v1/ca-prod-fsbo-ads/images/17/17f126c8-083e-4b4c-95ad-6c8a7e01115c?rule=kijijica-200-jpg,"-newly renovated -1 bedroom on Top Floor -includes 3 pc bath, kitchen and living room area -private entrance -1 parking spot -TTC accessible -gas and water included -shared outdoor space","$1,700.00",City of Toronto,Don Mills Road,18/01/2023
24,2 BED | 1 BATH - BASEMENT APT FOR RENT - SCARBOROUGH,https://www.kijiji.ca/v-apartments-condos/city-of-toronto/2-bed-1-bath-basement-apt-for-rent-scarborough/1644667195,https://media.kijiji.ca/api/v1/ca-prod-dealer-ads/images/7b/7b818225-e1dd-4214-b0bd-9dcefdedd385?rule=kijijica-200-jpg,"2 Bedrooms | 1 Bathroom, Upgraded Kitchen, Stone Countertops, Stainless Steel Appliances, Upgraded Bathrooms, Upgraded Back Splash, Huge Private Terrace, Tons of Natural Light. OPEN 24/7 - HAVE ...","$1,895.00",City of Toronto,George Henry Boulevard,18/01/2023
25,2 BED+DEN | 2 BATH - CONDO FOR RENT - ETOBICOKE | BLOOR ST W,https://www.kijiji.ca/v-apartments-condos/city-of-toronto/2-bed-den-2-bath-condo-for-rent-etobicoke-bloor-st-w/1646359483,https://media.kijiji.ca/api/v1/ca-prod-dealer-ads/images/db/dbf9203f-66a1-4fb4-a4a1-e043034b1ac8?rule=kijijica-200-jpg,"2 Bedrooms+Den | 2 Bathrooms, Upgraded Kitchen, Dishwasher, Microwave, Stainless Steel Appliances, Quartz Countertops, Upgraded Bathrooms, Upgraded Back Splash, Tons of Natural Light. OPEN 24/7 - ...","$3,135.00",City of Toronto,Corporate Drive,18/01/2023
26,Beautiful Bright 2 Bedroom 1 Bathroom Apartment,https://www.kijiji.ca/v-apartments-condos/city-of-toronto/beautiful-bright-2-bedroom-1-bathroom-apartment/1647605968,https://media.kijiji.ca/api/v1/ca-prod-fsbo-ads/images/26/26433dbf-e92c-4434-ad9e-b63b69a79aeb?rule=kijijica-200-jpg,Beautiful Bright 2 Bedroom 1 Bathroom apartment. Recently renovated kitchen with new appliances and a new washer and dryer in the unit. Updated bathroom with great finishes. Includes access to the ...,"$2,750.00",City of Toronto,Lee Centre Drive,18/01/2023
27,Renovated 2 Bedroom Apartment (Rogers/Silverthorn),https://www.kijiji.ca/v-apartments-condos/city-of-toronto/renovated-2-bedroom-apartment-rogers-silverthorn/1647605813,https://media.kijiji.ca/api/v1/ca-prod-dealer-ads/images/59/598ae45c-663a-40e2-870b-f47aa2259fb7?rule=kijijica-200-jpg,"Renting a renovated 2 bedroom apartment in the Rogers road and Silverthorn area. Central to many stores/ restaurants and minutes from public transportation. Brand new kitchen, bathroom, flooring. ...","$2,200.00",City of Toronto,Douro Street,18/01/2023
28,Large One Bedroom Unit with Parking for Rent at Keele & Lawrence,https://www.kijiji.ca/v-apartments-condos/city-of-toronto/large-one-bedroom-unit-with-parking-for-rent-at-keele-lawrence/1647603826,https://media.kijiji.ca/api/v1/ca-prod-fsbo-ads/images/3c/3c0d4da1-1f7c-4e79-a2b9-0bcdb4249a64?rule=kijijica-200-jpg,"Large one bedroom unit with parking, four-piece bath and a large balcony. Quiet, clean and safe building with security cameras throughout. Available immediately. Conveniently located at 50 Gulliver ...","$2,100.00",City of Toronto,Crawford Street,18/01/2023
29,Mirabella Lake Shore Condo - FOR RENT - $2650,https://www.kijiji.ca/v-apartments-condos/city-of-toronto/mirabella-lake-shore-condo-for-rent-2650/1647603428,https://media.kijiji.ca/api/v1/ca-prod-fsbo-ads/images/5b/5b72ef65-e8da-41c6-af95-9be64e331a64?rule=kijijica-200-jpg,"1926 Lakeshore Blvd, Toronto Suite 3002 1 Bedroom + 1 Den 1 Bath 570 Square Feet 1 Parking Space North, East & South Views, including views of High Park, CN Tower, and Lake Ontario! Pet Friendly w/ ...","$2,700.00",City of Toronto,Brock Avenue,18/01/2023
30,$2550 - 1 + 1 BEDROOM CONDO FOR RENT - SCARBOROUGH TOWN CENTRE,https://www.kijiji.ca/v-apartments-condos/city-of-toronto/2550-1-1-bedroom-condo-for-rent-scarborough-town-centre/1647603279,https://media.kijiji.ca/api/v1/ca-prod-fsbo-ads/images/78/780b7f93-b1ba-43cb-9ec8-08f144efabe2?rule=kijijica-200-jpg,Experience Easy Living At The Encore At Equinox! This Bright & Airy Corner Unit Will Have You Hooked As Soon As You Walk Through The Door! From The Floor To Ceiling Windows Showcasing The Gorgeous ...,"$2,550.00",City of Toronto,Middleton Street,18/01/2023
31,2 Bed 1 Bath Clean Basement for Rent at Keele St/Eglinton Ave W,https://www.kijiji.ca/v-apartments-condos/city-of-toronto/2-bed-1-bath-clean-basement-for-rent-at-keele-st-eglinton-ave-w/1647594090,https://media.kijiji.ca/api/v1/ca-prod-fsbo-ads/images/ff/ffc0b3b5-25ad-4809-9faf-dc9b1aa01ada?rule=kijijica-200-jpg,Move in any time. Only Serious Tenants. No Parking Spots available. So if you have a car then no point contacting. please text 6477938097 to book a showing. 2 Bed 1Bath Clean Basement for rent at ...,"$1,799.00",City of Toronto,Graydon Hall Drive,18/01/2023
32,Fully Furnished One Bedroom Unit In The Spire!,https://www.kijiji.ca/v-apartments-condos/city-of-toronto/fully-furnished-one-bedroom-unit-in-the-spire/1647599213,https://media.kijiji.ca/api/v1/ca-prod-fsbo-ads/images/6d/6d61fbb2-1aca-4397-9eec-c3d584c2115a?rule=kijijica-200-jpg,"Live in luxury at The Spire! Absolutely no wasted space in this super functional jr one bedroom. Fully furnished for your convenience! The unit contains breathtaking SE city and lake views, stainless ...","$2,650.00",City of Toronto,Graydon Hall Place,18/01/2023
33,One bedroom condo for rent,https://www.kijiji.ca/v-apartments-condos/city-of-toronto/one-bedroom-condo-for-rent/1647597411,https://media.kijiji.ca/api/v1/ca-prod-fsbo-ads/images/b4/b4db2c24-78d0-423b-ace1-4580aa68ab7a?rule=kijijica-200-jpg,"*Great location! South facing 1br+study & 1bath unit 626sf incl 1 parking & 1 locker. Open concept kitchen, full-sized s/s appliances, granite countertops, laminate flrs, large windows w/unobstructed ...","$2,490.00",City of Toronto,Sheppard Avenue West,18/01/2023
34,231 Fort York Blvd - 1 and Den with Parking and Locker!,https://www.kijiji.ca/v-apartments-condos/city-of-toronto/231-fort-york-blvd-1-and-den-with-parking-and-locker/1647594105,https://media.kijiji.ca/api/v1/ca-prod-fsbo-ads/images/9a/9a1ea07a-faf0-4e57-8c27-8830288eec75?rule=kijijica-200-jpg,"Beautiful and functional 1 bedroom and den with 1 washroom, parking/bike rack and locker available for rent! New washer/dryer, stainless appliances and brand new flooring installed. Steps to TTC, ...","$2,650.00",City of Toronto,Laura Road,18/01/2023
35,Room for rent,https://www.kijiji.ca/v-apartments-condos/city-of-toronto/room-for-rent/1647592931,https://media.kijiji.ca/api/v1/ca-prod-fsbo-ads/images/e8/e87058d4-283a-4163-a889-8ab5121aa893?rule=kijijica-200-jpg,Very close to UFT and Centennial college Newly Renovated Students are welcome,$900.00,City of Toronto,Kipling Avenue,18/01/2023
36,Bright & Clean 1 Bed + 1 Bath Apartment for rent!,https://www.kijiji.ca/v-apartments-condos/city-of-toronto/bright-clean-1-bed-1-bath-apartment-for-rent/1647577111,https://media.kijiji.ca/api/v1/ca-prod-fsbo-ads/images/4b/4be54113-4d96-447e-8a16-766654bb1b2e?rule=kijijica-200-jpg,"Enjoy downtown living with stunning views at 21 Iceboat Terrace! This 1 bed 1 bath has everything you need, including: - Stainless steel appliances - Quartz countertops - Dishwasher - A/C - In suite ...","$2,350.00",City of Toronto,Panorama Court,18/01/2023
37,"1 brm, 700ft2 SE-facing corner unit w/ unobstructed views",https://www.kijiji.ca/v-apartments-condos/city-of-toronto/1-brm-700ft2-se-facing-corner-unit-w-unobstructed-views/1647592394,https://media.kijiji.ca/api/v1/ca-prod-fsbo-ads/images/14/14636fa7-3412-4fe2-9bb3-9703359a3b25?rule=kijijica-200-jpg,Bright SE-facing sub-penthouse corner unit with unobstructed views of the Toronto skyline. 9ft floor-to-ceiling and wall-to-wall windows (blinds included/black-out blinds in bedroom). A flawless ...,"$3,000.00",City of Toronto,Davisville Avenue,18/01/2023
38,"2 BED / 2 BATH (FOR RENT) - YONGE & EGLINTON - $2,800/MONTH",https://www.kijiji.ca/v-apartments-condos/city-of-toronto/2-bed-2-bath-for-rent-yonge-eglinton-2-800-month/1647580445,https://media.kijiji.ca/api/v1/ca-prod-fsbo-ads/images/99/996b049c-9f9f-4a75-be39-d02ae05c2681?rule=kijijica-200-jpg,"Looking for a luxurious rental opportunity in the heart of Yonge & Eglinton? Look no further than E2 Condos! This stunning 2 bed, 2 bath corner unit boasts 9ft ceilings and floor-to-ceiling windows, ...","$2,800.00",City of Toronto,Acacia Road,18/01/2023
39,Basement Bachelor for Rent,https://www.kijiji.ca/v-apartments-condos/city-of-toronto/basement-bachelor-for-rent/1647591861,https://media.kijiji.ca/api/v1/ca-prod-fsbo-ads/images/ea/ea2e75d3-1869-4fb4-a351-b22d56554d95?rule=kijijica-200-jpg,Available February 1st. Nearest intersection Rogers Rd and Oakwood Ave. In Toronto. Looking for 1 working professional or 1 Student. Shared washroom with another tenant.,"$1,250.00",City of Toronto,Dwight Avenue,18/01/2023
40,"downtown,Cityplace, cn tower, 2 Bdrm 1 parking fort York Spadina",https://www.kijiji.ca/v-apartments-condos/city-of-toronto/downtown-cityplace-cn-tower-2-bdrm-1-parking-fort-york-spadina/1647591759,https://media.kijiji.ca/api/v1/ca-prod-dealer-ads/images/e8/e8b0c518-2547-432c-bd24-90090e206ee2?rule=kijijica-200-jpg,"South-West Facing Corner Suite With Lake Views! Situated In The Heart Of Cityplace Close To Ttc, 24-Hr Concierge, Rooftop Garden, Rock Climbing Wall, Indoor Pool, Fully Equipped Gym, Theatre, Party ...","$3,300.00",City of Toronto,New Toronto Street,18/01/2023
41,30 Edith: Apartment for rent in Toronto,https://www.kijiji.ca/v-apartments-condos/city-of-toronto/30-edith:-apartment-for-rent-in-toronto/1647586225,https://media.kijiji.ca/api/v1/ca-prod-dealer-ads/images/27/27817471-88fe-4adb-9bce-91d096b1f85f?rule=kijijica-200-jpg,"30 Edith offers comfortable living in the pleasant Yonge and Eglinton Corridor of Northern Toronto. Our 1 & 2 bedroom, pet-friendly suites offer indoor and outdoor parking, along with spacious ...","$1,899.00",City of Toronto,Lawrence Avenue West,18/01/2023
42,Oasis in the City!,https://www.kijiji.ca/v-apartments-condos/city-of-toronto/oasis-in-the-city/1636530011,https://media.kijiji.ca/api/v1/ca-prod-dealer-ads/images/f0/f0378266-104d-4eb8-af44-b474d245e042?rule=kijijica-200-jpg,"Oasis in the City! Rare Sherwood Park rental opportunity. Open concept main floor with updated kitchen and walkout to huge raised patio. 4 bedrooms, including the 3rd floor loft. Bright lower level ...","$3,800.00",City of Toronto,Scarlett Road,18/01/2023
43,WESTQ - 2 Bedroom + Den 1 Bath Apartment for Rent,https://www.kijiji.ca/v-apartments-condos/city-of-toronto/westq-2-bedroom-den-1-bath-apartment-for-rent/1628552178,https://media.kijiji.ca/api/v1/ca-prod-dealer-ads/images/dc/dcb53acd-5983-45c7-a597-a76e29531d2e?rule=kijijica-200-jpg,Building Information A most stylish address. There is something to be said for renting in the epi-centre of the city's hottest neighbourhood – it was actually ranked second-coolest neighbourhood in ...,"$2,900.00",City of Toronto,Scarborough Golf Club Road,18/01/2023
44,Updated Large 1-bedroom downtown condo!,https://www.kijiji.ca/v-apartments-condos/city-of-toronto/updated-large-1-bedroom-downtown-condo/1646839412,https://media.kijiji.ca/api/v1/ca-prod-dealer-ads/images/c0/c0532615-0fa6-41dc-b067-269136d02ada?rule=kijijica-200-jpg,"Updated Large 1-bedroom downtown condo! Prime downtown location (Bay Street and St. Joseph) Fully equipped gym, racquetball court, basket ball court, spa and a full in-door pool (salt water) 24hr ...","$2,495.00",City of Toronto,Hill Crescent,18/01/2023
45,"1 bdrm – $1,950 – Yonge & Eglinton!",https://www.kijiji.ca/v-apartments-condos/city-of-toronto/1-bdrm-1-950-yonge-eglinton/1647585998,https://media.kijiji.ca/api/v1/ca-prod-dealer-ads/images/af/afcf529b-b2a3-4a0f-b16a-cc5b5cf54592?rule=kijijica-200-jpg,"Located on Eglinton just east of Yonge dont miss this opportunity to live in a boutique property in the heart of Midtown! Priced at $1,950 for a limited time plus hydro Laundry on site Brand new ...","$1,950.00",City of Toronto,Cordova Avenue,18/01/2023
